{
  "schema_version": "sas-autologon-state-proof-result/v1",
  "operation_id": "autologon.state_proof",
  "evidence_class": "operator_local",
  "classification": "confirmed_state_transition",
  "reason_codes": ["expected_state_transition_observed"],
  "fixture_mode": false,
  "target_count": 1,
  "proof": {"before_snapshot_captured": true, "after_snapshot_captured": true, "state_change_observed": true, "expected_account_match": true, "reboot_observed": false, "automatic_sign_in_observed": false},
  "safety": {"collector_target_mutation_performed": false, "target_side_sysadminsuite_artifacts_written": false, "default_password_value_collected": false, "human_actor_attribution_claimed": false},
  "proof_level": "operator_local_state_delta",
  "proof_ceiling": "Operator-local state transition only; reboot, automatic sign-in, current-token access, application behavior, and human attribution are not proven."
}
