{
  "schema_version": "sas-autologon-state-proof-result/v1",
  "operation_id": "autologon.state_proof",
  "evidence_class": "sanitized_fixture",
  "classification": "fixture_contract_pass",
  "reason_codes": ["synthetic_state_transition_contract_validated"],
  "fixture_mode": true,
  "target_count": 1,
  "proof": {
    "before_snapshot_captured": true,
    "after_snapshot_captured": true,
    "state_change_observed": true,
    "expected_account_match": true,
    "reboot_observed": false,
    "automatic_sign_in_observed": false
  },
  "safety": {
    "collector_target_mutation_performed": false,
    "target_side_sysadminsuite_artifacts_written": false,
    "default_password_value_collected": false,
    "human_actor_attribution_claimed": false
  },
  "proof_level": "sanitized_fixture_contract",
  "proof_ceiling": "Sanitized state fixture only; no live registry state, reboot, sign-in, or human attribution is proven."
}
